[
  {
    "name": " John Smith ",
    "values": [
      "quick",
      "brown",
      "fox"
    ],
    "string": "Quick   brown fox   ",
    "nested": {
      "name": "nested value"
    },
    "email": "John.SMith@email.COM",
    "credit_card": "1234-5678-9012-3456",
    "password": "abc123"
  },
  {
    "name": " Mary Brown ",
    "values": [
      "Lorem",
      "ipsum",
      "dolor",
      "sit",
      "amet"
    ],
    "string": "Lorem ipsum dolor sit amet, consectetur adipiscing elit",
    "nested": {
      "name": "nested value"
    },
    "email": "MARY@EMAIL.COM",
    "credit_card": "4111-1111-1111-1111",
    "password": "xyz999"
  }
]